Title,Summary,Published,Link,Authors
Concentration of ergotropy in many-body systems,"Ergotropy -- the maximal amount of unitarily extractable work -- measures the
``charge level'' of quantum batteries. We prove that in large many-body
batteries ergotropy exhibits a concentration of measure phenomenon. Namely, the
ergotropy of such systems is almost constant for almost all states sampled from
the Hilbert--Schmidt measure. We establish this by first proving that
ergotropy, as a function of the state, is Lipschitz-continuous with respect to
the Bures distance, and then applying Levy's measure concentration lemma. In
parallel, we showcase the analogous properties of von Neumann entropy,
compiling and adapting known results about its continuity and concentration
properties. Furthermore, we consider the situation with the least amount of
prior information about the state. This corresponds to the quantum version of
the Jeffreys prior distribution -- the Bures measure. In this case, there exist
no analytical bounds guaranteeing exponential concentration of measure.
Nonetheless, we provide numerical evidence that ergotropy, as well as von
Neumann entropy, concentrate also in this case.",2024-12-27T18:58:43Z,http://arxiv.org/abs/2412.19801v1,"Karen V. Hovhannisyan, Rick P. A. Simon, Janet Anders"
Entangled dual-comb spectroscopy,"Optical frequency combs have emerged as a cornerstone for a wide range of
areas, including spectroscopy, ranging, optical clocks, time and frequency
transfer, waveform synthesis, and communications. However, quantum mechanical
fluctuations of the optical carrier impose fundamental performance limits on
the precision of traditional classical laser frequency combs, particularly in
their use for interferometry and spectroscopy. Entanglement, as a
quintessential quantum resource, allows for surpassing the fundamental limits
of classical systems. Here, we introduce and experimentally demonstrate
entangled dual-comb spectroscopy (EDCS) that surmounts the fundamental limits
of classical DCS. EDCS builds on tailored entangled spectral structures of the
frequency combs, enabling simultaneous detection of all comb lines below the
standard quantum limit of classical DCS. Applying EDCS in gas detection, we
achieve a 2.6 dB enhancement in signal-to-noise ratio and a 1.7-fold reduction
in integration time over classical DCS, rendering EDCS particularly suited for
dynamic chemical and biological sensing, where fast, precise measurements
subject to power constraints are required. EDCS represents a new paradigm for
quantum frequency combs, underscoring their prospects in a plethora of
applications in precision metrology, spectroscopy, and timekeeping.",2024-12-27T18:57:59Z,http://arxiv.org/abs/2412.19800v1,"Abdulkarim Hariri, Shuai Liu, Haowei Shi, Quntao Zhuang, Xudong Fan, Zheshen Zhang"
Computing Direct Sum Decompositions,"The problems of finding isomorphism classes of indecomposable modules with
certain properties, or determining the indecomposable summands of a module, are
ubiquitous in commutative algebra, group theory, representation theory, and
other fields. The purpose of this work is to describe and prove correctness of
a practical algorithm for computing indecomposable summands of finitely
generated modules over a finitely generated k-algebra, for k a field of
positive characteristic. Our algorithm works over multigraded rings, which
enables the computation of indecomposable summands of coherent sheaves on
subvarieties of toric varieties (in particular, for varieties embedded in
projective space). We also present multiple examples, including some which
present previously unknown phenomena regarding the behavior of summands of
Frobenius pushforwards and syzygies over Artinian rings.",2024-12-27T18:57:35Z,http://arxiv.org/abs/2412.19799v1,"Devlin Mallory, Mahrud Sayrafi"
Non-Scaling Topological Defects and Gravitational Waves in Higgs Portal,"One of the simplest extensions of the Standard Model is the Higgs portal
extension involving a dark Higgs. Dark sectors that include dark matter
candidates, WIMPs, axions, and dark photons, can naturally have this type of
interaction, where the dark Higgs is charged under some symmetry, which may or
may not be spontaneous broken by the vacuum expectation value. In this paper,
using lattice simulations, I show that if the reheating temperature of the
Universe is sufficiently high, topological defects such as domain walls and
cosmic strings associated with these symmetries are naturally formed even if
the symmetries are never restored due to negative thermal mass squareds. This
occurs due to the early Universe's non-adiabatic oscillation of the Higgs
around the onset of oscillation, which overshoots the origin, and tachyonic
instability that enhances fluctuations. The gravitational waves generated by
these topological defects may be very significant due to the energetic
processes induced by matter effects in the hot and dense Universe irrelevant to
the typical energy scale of the dark sector in the vacuum or whether the
symmetry is broken in the vacuum. Alongside earlier studies such as usual phase
transition, melting domain walls and melting cosmic strings scenarios that
assume a symmetric phase in the early Universe, the Higgs portal models
naturally predict local overdensities from topological defects, which may
induce miniclusters and primordial black holes, as well as the gravitational
waves.These phenomena provide novel opportunities to search for such scenarios.
I also perform various numerical simulations for the relevant topic including
melting domain walls and cosmic strings with inflationary and Gaussian
fluctuations, for comparison--which have not been performed previously.",2024-12-27T18:57:22Z,http://arxiv.org/abs/2412.19798v1,Wen Yin
"Streamlined Krylov construction and classification of ergodic Floquet
  systems","We generalize Krylov construction to periodically driven (Floquet) quantum
systems using the theory of orthogonal polynomials on the unit circle. Compared
to other approaches, our method works faster and maps any quantum dynamics to a
one-dimensional tight-binding Krylov chain. We also suggest a classification of
chaotic and integrable Floquet systems based on the asymptotic behavior of
Krylov chain hopping parameters (Verblunsky coefficients). We illustrate this
classification with random matrix ensembles, kicked top, and kicked Ising
chain.",2024-12-27T18:56:27Z,http://arxiv.org/abs/2412.19797v1,"Nikita Kolganov, Dmitrii A. Trunin"
"Generalized Grade-of-Membership Estimation for High-dimensional Locally
  Dependent Data","This work focuses on the mixed membership models for multivariate categorical
data widely used for analyzing survey responses and population genetics data.
These grade of membership (GoM) models offer rich modeling power but present
significant estimation challenges for high-dimensional polytomous data. Popular
existing approaches, such as Bayesian MCMC inference, are not scalable and lack
theoretical guarantees in high-dimensional settings. To address this, we first
observe that data from this model can be reformulated as a three-way
(quasi-)tensor, with many subjects responding to many items with varying
numbers of categories. We introduce a novel and simple approach that flattens
the three-way quasi-tensor into a ""fat"" matrix, and then perform a singular
value decomposition of it to estimate parameters by exploiting the singular
subspace geometry. Our fast spectral method can accommodate a broad range of
data distributions with arbitrarily locally dependent noise, which we formalize
as the generalized-GoM models. We establish finite-sample entrywise error
bounds for the generalized-GoM model parameters. This is supported by a new
sharp two-to-infinity singular subspace perturbation theory for locally
dependent and flexibly distributed noise, a contribution of independent
interest. Simulations and applications to data in political surveys, population
genetics, and single-cell sequencing demonstrate our method's superior
performance.",2024-12-27T18:51:15Z,http://arxiv.org/abs/2412.19796v1,"Ling Chen, Chengzhu Huang, Yuqi Gu"
"g-factor theory of Si/SiGe quantum dots: spin-valley and giant
  renormalization effects","Understanding the $g$-factor physics of Si/SiGe quantum dots is crucial for
realizing high-quality spin qubits. While previous work has explained some
aspects of $g$-factor physics in idealized geometries, the results do not
extend to general cases and they miss several important features. Here, we
construct a theory that gives $g$ in terms of readily computable matrix
elements, and can be applied to all Si/SiGe heterostructures of current
interest. As a concrete example, which currently has no $g$-factor
understanding, we study the so-called Wiggle Well structure, containing Ge
concentration oscillations inside the quantum well. Here we find a significant
renormalization of the $g$-factor compared to conventional Si/SiGe quantum
wells. We also uncover a giant $g$-factor suppression of order
$\mathcal{O}(1)$, which arises due to spin-valley coupling, and occurs at
locations of low valley splitting. Our work therefore opens up new avenues for
$g$-factor engineering in Si/SiGe quantum dots.",2024-12-27T18:50:38Z,http://arxiv.org/abs/2412.19795v1,"Benjamin D. Woods, Merritt P. Losert, Robert Joynt, Mark Friesen"
InfAlign: Inference-aware language model alignment,"Language model alignment has become a critical step in training modern
generative language models. The goal of alignment is to finetune a reference
model such that the win rate of a sample from the aligned model over a sample
from the reference model is high, subject to a KL divergence constraint. Today,
we are increasingly using inference-time algorithms (e.g., Best-of-N,
controlled decoding, tree search) to decode from language models rather than
standard sampling. However, the alignment objective does not capture such
inference-time decoding procedures. We show that the existing alignment
framework is sub-optimal in view of such inference-time methods. We then modify
the alignment objective and propose a framework for inference-aware alignment
(IAPO). We prove that for any inference-time decoding algorithm, the optimal
solution that optimizes the inference-time win rate of the aligned policy
against the reference policy is the solution to the typical RLHF problem with a
transformation of the reward. This motivates us to provide the KL-regularized
calibrate-and-transform RL (CTRL) algorithm to solve this problem, which
involves a reward calibration step and a KL-regularized reward maximization
step with a transformation of the calibrated reward. We particularize our study
to two important inference-time strategies: best-of-N sampling and best-of-N
jailbreaking, where N responses are sampled from the model and the one with the
highest or lowest reward is selected. We propose specific transformations for
these strategies and demonstrate that our framework offers significant
improvements over existing state-of-the-art methods for language model
alignment. Empirically, we outperform baselines that are designed without
taking inference-time decoding into consideration by 8-12% and 4-9% on
inference-time win rates over the Anthropic helpfulness and harmlessness dialog
benchmark datasets.",2024-12-27T18:45:36Z,http://arxiv.org/abs/2412.19792v1,"Ananth Balashankar, Ziteng Sun, Jonathan Berant, Jacob Eisenstein, Michael Collins, Adrian Hutter, Jong Lee, Chirag Nagpal, Flavien Prost, Aradhana Sinha, and Ananda Theertha Suresh, Ahmad Beirami"
"Local Characteristic Decomposition of Equilibrium Variables for
  Hyperbolic Systems of Balance Laws","This paper is concerned with high-order numerical methods for hyperbolic
systems of balance laws. Such methods are typically based on high-order
piecewise polynomial reconstructions (interpolations) of the computed discrete
quantities. However, such reconstructions (interpolations) may be oscillatory
unless the reconstruction (interpolation) procedure is applied to the local
characteristic variables via the local characteristic decomposition (LCD).
Another challenge in designing accurate and stable high-order schemes is
related to enforcing a delicate balance between the fluxes, sources, and
nonconservative product terms: a good scheme should be well-balanced (WB) in
the sense that it should be capable of exactly preserving certain (physically
relevant) steady states. One of the ways to ensure that the reconstruction
(interpolation) preserves these steady states is to apply the reconstruction
(interpolation) to the equilibrium variables, which are supposed to be constant
at the steady states. To achieve this goal and to keep the reconstruction
(interpolation) non-oscillatory, we introduce a new LCD of equilibrium
variables. We apply the developed technique to the fifth-order Ai-WENO-Z
interpolation implemented within the WB A-WENO framework recently introduced in
[S. Chu, A. Kurganov, and R. Xin, Beijing J. of Pure and Appl. Math., to
appear], and illustrate its performance on a variety of numerical examples.",2024-12-27T18:45:23Z,http://arxiv.org/abs/2412.19791v1,"Shaoshuai Chu, Alexander Kurganov, Mingye Na, Ruixiao Xin"
"Bottom-up robust modeling for the foraging behavior of Physarum
  polycephalum","The true slime mold \textit{Physarum polycephalum} has the remarkable
capability to perform self-organized activities such as network formation among
food sources. Despite well reproducing the emergence of slime networks,
existing models are limited in the investigation of the minimal mechanisms, at
the microscopic scale, that ensure robust problem-solving capabilities at the
macroscopic scale. To this end, we develop three progressively more complex
multi-agent models to provide a flexible framework to understand the
self-organized foraging and network formation behaviors of \textit{Physarum}.
The hierarchy of models allows for a stepwise investigation of the minimal set
of rules that allow bio-inspired computing agents to achieve the desired
behaviors on nutrient-poor substrates. By introducing a quantitative measure of
connectedness among food sources, we assess the sensitivity of the model to
user-defined and bio-inspired parameters, as well as the robustness of the
model to parameter heterogeneity across agents. We ultimately observe the
robust emergence of pattern formation, in line with experimental evidence.
Overall, our study sheds light onto the basic mechanisms of self-organization
and paves the way towards the development of decentralized strategies for
network formation in engineered systems, focusing on trade-offs between
biological fidelity and computational efficiency.",2024-12-27T18:44:14Z,http://arxiv.org/abs/2412.19790v1,"Damiano Reginato, Daniele Proverbio, Giulia Giordano"
Transmon qutrit-based simulation of spin-1 AKLT systems,"Qutrit-based quantum circuits could help reduce the overall circuit depths,
and hence the noise, when the system of interest has local dimension of three.
Accessing second excited states in superconducting transmons provides a
straightforward hardware realization of three-level systems, or qutrits, useful
for such ternary encoding. In this work, we successfully calibrate pulse gates
to a low error rate to obtain transmon qutrits. We use these qutrits to
simulate one-dimensional spin-1 AKLT states (Affleck, Lieb, Kennedy, and
Tasaki) which exhibit a multitude of interesting phenomena such as
topologically protected ground states, string order and the existence of a
robust Berry phase. We demonstrate the efficacy of qutrit-based simulation by
preparing high-fidelity ground states of the AKLT Hamiltonian with open
boundaries for various chain lengths. We then use ground state preparations of
the perturbed AKLT Hamiltonian with periodic boundaries to calculate the Berry
phase and illustrate non-trivial ground state topology. We further present
scalable methods for preparing the AKLT state and computing its Berry phase,
and use tensor network simulations to establish the advantage of qutrit-based
implementation over qubit-based ones in the presence of noise. Our work
provides a pathway toward more general spin-1 physics simulations using
transmon qutrits, with applications in chemistry, magnetism, and topological
phases of matter.",2024-12-27T18:32:39Z,http://arxiv.org/abs/2412.19786v1,"Keerthi Kumaran, Faisal Alam, Norhan Eassa, Kaelyn Ferris, Xiao Xiao, Lukasz Cincio, Nicholas Bronn, Arnab Banerjee"
"Enhancing Whisper's Accuracy and Speed for Indian Languages through
  Prompt-Tuning and Tokenization","Automatic speech recognition has recently seen a significant advancement with
large foundational models such as Whisper. However, these models often struggle
to perform well in low-resource languages, such as Indian languages. This paper
explores two novel approaches to enhance Whisper's multilingual speech
recognition performance in Indian languages. First, we propose prompt-tuning
with language family information, which enhances Whisper's accuracy in
linguistically similar languages. Second, we introduce a novel tokenizer that
reduces the number of generated tokens, thereby accelerating Whisper's
inference speed. Our extensive experiments demonstrate that the tokenizer
significantly reduces inference time, while prompt-tuning enhances accuracy
across various Whisper model sizes, including Small, Medium, and Large.
Together, these techniques achieve a balance between optimal WER and inference
speed.",2024-12-27T18:32:24Z,http://arxiv.org/abs/2412.19785v1,"Kumud Tripathi, Raj Gothi, Pankaj Wasnik"
Can AI Help with Your Personal Finances?,"In recent years, Large Language Models (LLMs) have emerged as a
transformative development in artificial intelligence (AI), drawing significant
attention from industry and academia. Trained on vast datasets, these
sophisticated AI systems exhibit impressive natural language processing and
content generation capabilities. This paper explores the potential of LLMs to
address key challenges in personal finance, focusing on the United States. We
evaluate several leading LLMs, including OpenAI's ChatGPT, Google's Gemini,
Anthropic's Claude, and Meta's Llama, to assess their effectiveness in
providing accurate financial advice on topics such as mortgages, taxes, loans,
and investments. Our findings show that while these models achieve an average
accuracy rate of approximately 70%, they also display notable limitations in
certain areas. Specifically, LLMs struggle to provide accurate responses for
complex financial queries, with performance varying significantly across
different topics. Despite these limitations, the analysis reveals notable
improvements in newer versions of these models, highlighting their growing
utility for individuals and financial advisors. As these AI systems continue to
evolve, their potential for advancing AI-driven applications in personal
finance becomes increasingly promising.",2024-12-27T18:25:27Z,http://arxiv.org/abs/2412.19784v1,"Oudom Hean, Utsha Saha, Binita Saha"
A note on the log-concavity of parking functions,"We settle a conjecture of B\'ona regarding the log-concavity of a certain
statistic on parking functions by utilizing recent log-concavity results on
matroids. This result allows us to also prove that connected, labeled graphs
graded by their number of edges are log-concave. Furthermore, we generalize
these results to $G$-parking functions.",2024-12-27T18:25:24Z,http://arxiv.org/abs/2412.19783v1,Joseph Pappe
Cosmological perturbations meet Wheeler DeWitt,"We study solutions of the Wheeler DeWitt (WdW) equation in order to recover
standard results of cosmological perturbation theory. In mini-superspace, we
introduce a dimensionless gravitational coupling $\alpha$ that is typically
very small and functions like $\hbar$ in a WKB expansion. We seek solutions of
the form $\Psi = e^{iS/\alpha} \psi$ that are the closest quantum analog of a
given classical background spacetime. The function $S$ satisfies the
Hamilton-Jacobi equation, while $\psi$ obeys a Schr\""odinger-like equation and
has a clear probabilistic interpretation. By using the semiclassical limit we
express the relation between $\psi$ and the wavefunction of the universe in
perturbation theory, $\psi_P$. We apply our formalism to two main examples. The
first is a scalar field with a purely exponential potential, of which
particularly simple, scaling solutions are known. The other is a slow-roll
scenario expanded in the vicinity of the origin in field space. We discuss
possible deviations from the classical background trajectory as well as the
higher ``time"" derivative terms that are present in the WdW equation but not in
the perturbative approach. We clarify the conditional probability content of
the wavefunctions and how this is related with the standard gauge fixing
procedure in perturbation theory.",2024-12-27T18:25:17Z,http://arxiv.org/abs/2412.19782v1,"Federico Piazza, Siméon Vareilles"
"Machine Learning for Sentiment Analysis of Imported Food in Trinidad and
  Tobago","This research investigates the performance of various machine learning
algorithms (CNN, LSTM, VADER, and RoBERTa) for sentiment analysis of Twitter
data related to imported food items in Trinidad and Tobago. The study addresses
three primary research questions: the comparative accuracy and efficiency of
the algorithms, the optimal configurations for each model, and the potential
applications of the optimized models in a live system for monitoring public
sentiment and its impact on the import bill. The dataset comprises tweets from
2018 to 2024, divided into imbalanced, balanced, and temporal subsets to assess
the impact of data balancing and the COVID-19 pandemic on sentiment trends. Ten
experiments were conducted to evaluate the models under various configurations.
Results indicated that VADER outperformed the other models in both multi-class
and binary sentiment classifications. The study highlights significant changes
in sentiment trends pre- and post-COVID-19, with implications for import
policies.",2024-12-27T18:25:08Z,http://arxiv.org/abs/2412.19781v1,"Cassandra Daniels, Koffka Khan"
Tensor Network Estimation of Distribution Algorithms,"Tensor networks are a tool first employed in the context of many-body quantum
physics that now have a wide range of uses across the computational sciences,
from numerical methods to machine learning. Methods integrating tensor networks
into evolutionary optimization algorithms have appeared in the recent
literature. In essence, these methods can be understood as replacing the
traditional crossover operation of a genetic algorithm with a tensor
network-based generative model. We investigate these methods from the point of
view that they are Estimation of Distribution Algorithms (EDAs). We find that
optimization performance of these methods is not related to the power of the
generative model in a straightforward way. Generative models that are better
(in the sense that they better model the distribution from which their training
data is drawn) do not necessarily result in better performance of the
optimization algorithm they form a part of. This raises the question of how
best to incorporate powerful generative models into optimization routines. In
light of this we find that adding an explicit mutation operator to the output
of the generative model often improves optimization performance.",2024-12-27T18:22:47Z,http://arxiv.org/abs/2412.19780v1,"John Gardiner, Javier Lopez-Piqueres"
Extended Set Difference : Inverse Operation of Minkowski Summation,"This paper introduces the extended set difference, a generalization of the
Hukuhara and generalized Hukuhara differences, defined for compact convex sets
in $R^d$. The proposed difference guarantees the existence and uniqueness for
any pair of such sets, offering a broader framework for set arithmetic. The
paper also explores the properties of this new difference.",2024-12-27T18:19:27Z,http://arxiv.org/abs/2412.19779v1,"Arie Beresteanu, Behrooz Moosavi Ramezanzadeh"
"Application of normalizing flows to nuclear many-body perturbation
  theory","Many-body perturbation theory provides a powerful framework to study the
ground state and thermodynamic properties of nuclear matter as well as
associated single-particle potentials and response functions within a
systematic order-by-order expansion. However, computational challenges can
emerge beyond the lowest orders of perturbation theory, especially when
computing both single-particle potentials and response functions, which in
general are complex-valued and require Cauchy principal value calculations of
high-dimensional integrals. We demonstrate that normalizing flows are suitable
for Monte Carlo importance sampling of both regular and irregular functions
appearing in nuclear many-body calculations. Normalizing flows are a class of
machine learning models that can be used to build and sample from complicated
distributions through a bijective mapping from a simple base distribution.
Furthermore, a well-trained model for a certain target integrand can be
efficiently transferred to calculate related integrals with varying physical
conditions. These features can enable more efficient tabulations of nuclear
physics inputs to numerical simulations of supernovae and neutron star mergers
across varying physical conditions and nuclear force models.",2024-12-27T18:18:20Z,http://arxiv.org/abs/2412.19777v1,"Pengsheng Wen, Jeremy W. Holt, Albany Blackburn"
