Title,Summary,Published,Link,Authors
"Scalable Hierarchical Reinforcement Learning for Hyper Scale Multi-Robot
  Task Planning","To improve the efficiency of warehousing system and meet huge customer
orders, we aim to solve the challenges of dimension disaster and dynamic
properties in hyper scale multi-robot task planning (MRTP) for robotic mobile
fulfillment system (RMFS). Existing research indicates that hierarchical
reinforcement learning (HRL) is an effective method to reduce these challenges.
Based on that, we construct an efficient multi-stage HRL-based multi-robot task
planner for hyper scale MRTP in RMFS, and the planning process is represented
with a special temporal graph topology. To ensure optimality, the planner is
designed with a centralized architecture, but it also brings the challenges of
scaling up and generalization that require policies to maintain performance for
various unlearned scales and maps. To tackle these difficulties, we first
construct a hierarchical temporal attention network (HTAN) to ensure basic
ability of handling inputs with unfixed lengths, and then design multi-stage
curricula for hierarchical policy learning to further improve the scaling up
and generalization ability while avoiding catastrophic forgetting.
Additionally, we notice that policies with hierarchical structure suffer from
unfair credit assignment that is similar to that in multi-agent reinforcement
learning, inspired of which, we propose a hierarchical reinforcement learning
algorithm with counterfactual rollout baseline to improve learning performance.
Experimental results demonstrate that our planner outperform other
state-of-the-art methods on various MRTP instances in both simulated and
real-world RMFS. Also, our planner can successfully scale up to hyper scale
MRTP instances in RMFS with up to 200 robots and 1000 retrieval racks on
unlearned maps while keeping superior performance over other methods.",2024-12-27T09:07:11Z,http://arxiv.org/abs/2412.19538v1,"Xuan Zhou, Xiang Shi, Lele Zhang, Chen Chen, Hongbo Li, Lin Ma, Fang Deng, Jie Chen"
"Potential Vector Fields in $\mathbb R^3$ and $α$-Meridional
  Mappings of the Second Kind $(α\in \mathbb R)$","This paper extends approach developed in a recent author's paper on analytic
models of potential fields in inhomogeneous media. New three-dimensional
analytic models of potential vector fields in some layered media are
constructed. Properties of various analytic models in Cartesian and cylindrical
coordinates in $\mathbb R^3$ are compared. The original properties of the
Jacobian matrix $\mathbf{J}(\vec V)$ of potential meridional fields $\vec V$ in
cylindrically layered media, where $\phi( \rho) = \rho^{-\alpha}$ $(\alpha \in
\mathbb R)$, lead to the concept of \emph{$\alpha$-meridional mappings of the
first and second kind}. The concept of \emph{$\alpha$-Meridional functions of
the first and second kind} naturally arises in this way. When $\alpha =1$, the
special concept of \emph{Radially holomorphic functions in $\mathbb R^3$},
introduced by G\""{u}rlebeck, Habetha and Spr\""{o}ssig in 2008, is developed in
more detail. Certain key properties of the radially holomorphic functions $G$
and functions reversed with respect to $G$ are first characterized. Surprising
properties of the radially holomorphic potentials represented by superposition
of the radially holomorphic exponential function $e^{\breve{\beta} x}$
$(\breve{\beta} \in \mathbb R)$ and function reversed with respect to
$e^{\breve{\beta} x}$ are demonstrated explicitly. The basic properties of the
radially holomorphic potential represented by the radially holomorphic
extension of the Joukowski transformation in $\mathbb R^3$ are studied.",2024-12-27T09:03:29Z,http://arxiv.org/abs/2412.19536v1,Dmitry Bryukhov
"StyleRWKV: High-Quality and High-Efficiency Style Transfer with
  RWKV-like Architecture","Style transfer aims to generate a new image preserving the content but with
the artistic representation of the style source. Most of the existing methods
are based on Transformers or diffusion models, however, they suffer from
quadratic computational complexity and high inference time. RWKV, as an
emerging deep sequence models, has shown immense potential for long-context
sequence modeling in NLP tasks. In this work, we present a novel framework
StyleRWKV, to achieve high-quality style transfer with limited memory usage and
linear time complexity. Specifically, we propose a Recurrent WKV (Re-WKV)
attention mechanism, which incorporates bidirectional attention to establish a
global receptive field. Additionally, we develop a Deformable Shifting
(Deform-Shifting) layer that introduces learnable offsets to the sampling grid
of the convolution kernel, allowing tokens to shift flexibly and adaptively
from the region of interest, thereby enhancing the model's ability to capture
local dependencies. Finally, we propose a Skip Scanning (S-Scanning) method
that effectively establishes global contextual dependencies. Extensive
experiments with analysis including qualitative and quantitative evaluations
demonstrate that our approach outperforms state-of-the-art methods in terms of
stylization quality, model complexity, and inference efficiency.",2024-12-27T09:01:15Z,http://arxiv.org/abs/2412.19535v1,"Miaomiao Dai, Qianyu Zhou, Lizhuang Ma"
"P3S-Diffusion:A Selective Subject-driven Generation Framework via Point
  Supervision","Recent research in subject-driven generation increasingly emphasizes the
importance of selective subject features. Nevertheless, accurately selecting
the content in a given reference image still poses challenges, especially when
selecting the similar subjects in an image (e.g., two different dogs). Some
methods attempt to use text prompts or pixel masks to isolate specific
elements. However, text prompts often fall short in precisely describing
specific content, and pixel masks are often expensive. To address this, we
introduce P3S-Diffusion, a novel architecture designed for context-selected
subject-driven generation via point supervision. P3S-Diffusion leverages
minimal cost label (e.g., points) to generate subject-driven images. During
fine-tuning, it can generate an expanded base mask from these points, obviating
the need for additional segmentation models. The mask is employed for
inpainting and aligning with subject representation. The P3S-Diffusion
preserves fine features of the subjects through Multi-layers Condition
Injection. Enhanced by the Attention Consistency Loss for improved training,
extensive experiments demonstrate its excellent feature preservation and image
generation capabilities.",2024-12-27T08:59:01Z,http://arxiv.org/abs/2412.19533v1,"Junjie Hu, Shuyong Gao, Lingyi Hong, Qishan Wang, Yuzhou Zhao, Yan Wang, Wenqiang Zhang"
"Optical probing of fractal and multifractal connection to structural
  disorder in weakly optical disordered media: Application to cancer detection","The light scattering experiment establishes a relationship between refractive
index fluctuations and fractal dimension in weakly scattering tissue-like
media. Based on the box-counting approach, an analytical model is developed and
shows that the fractal dimension has a functional dependency on the structural
disorder or refractive index fluctuation for short-range correlation and
approximately linearly depends on each other for tissue-like media. Several
parametric imaging systems can be connected using this approach. Further,
tissue's weak multifractality optical scattering is explored using the
box-counting method. It is shown that with a functional transformation, the
distribution follows lognormal distributions.",2024-12-27T08:54:29Z,http://arxiv.org/abs/2412.19532v1,"Santanu Maity, Mousa Alrubayan, Ishmael Apachigwao, Dhruvil Solanki, Prabhakar Pradhan"
Is Your Text-to-Image Model Robust to Caption Noise?,"In text-to-image (T2I) generation, a prevalent training technique involves
utilizing Vision Language Models (VLMs) for image re-captioning. Even though
VLMs are known to exhibit hallucination, generating descriptive content that
deviates from the visual reality, the ramifications of such caption
hallucinations on T2I generation performance remain under-explored. Through our
empirical investigation, we first establish a comprehensive dataset comprising
VLM-generated captions, and then systematically analyze how caption
hallucination influences generation outcomes. Our findings reveal that (1) the
disparities in caption quality persistently impact model outputs during
fine-tuning. (2) VLMs confidence scores serve as reliable indicators for
detecting and characterizing noise-related patterns in the data distribution.
(3) even subtle variations in caption fidelity have significant effects on the
quality of learned representations. These findings collectively emphasize the
profound impact of caption quality on model performance and highlight the need
for more sophisticated robust training algorithm in T2I. In response to these
observations, we propose a approach leveraging VLM confidence score to mitigate
caption noise, thereby enhancing the robustness of T2I models against
hallucination in caption.",2024-12-27T08:53:37Z,http://arxiv.org/abs/2412.19531v1,"Weichen Yu, Ziyan Yang, Shanchuan Lin, Qi Zhao, Jianyi Wang, Liangke Gui, Matt Fredrikson, Lu Jiang"
"The Value of AI Advice: Personalized and Value-Maximizing AI Advisors
  Are Necessary to Reliably Benefit Experts and Organizations","Despite advances in AI's performance and interpretability, AI advisors can
undermine experts' decisions and increase the time and effort experts must
invest to make decisions. Consequently, AI systems deployed in high-stakes
settings often fail to consistently add value across contexts and can even
diminish the value that experts alone provide. Beyond harm in specific domains,
such outcomes impede progress in research and practice, underscoring the need
to understand when and why different AI advisors add or diminish value. To
bridge this gap, we stress the importance of assessing the value AI advice
brings to real-world contexts when designing and evaluating AI advisors.
Building on this perspective, we characterize key pillars -- pathways through
which AI advice impacts value -- and develop a framework that incorporates
these pillars to create reliable, personalized, and value-adding advisors. Our
results highlight the need for system-level, value-driven development of AI
advisors that advise selectively, are tailored to experts' unique behaviors,
and are optimized for context-specific trade-offs between decision improvements
and advising costs. They also reveal how the lack of inclusion of these pillars
in the design of AI advising systems may be contributing to the failures
observed in practical applications.",2024-12-27T08:50:54Z,http://arxiv.org/abs/2412.19530v1,"Nicholas Wolczynski, Maytal Saar-Tsechansky, Tong Wang"
"Real-time Reflectance Generation for UAV Multispectral Imagery using an
  Onboard Downwelling Spectrometer in Varied Weather Conditions","Advancements in unmanned aerial vehicle (UAV) remote sensing with spectral
imaging enable efficient assessment of critical agronomic traits. However,
existing reflectance calibration or generation methods suffer from limited
prediction accuracy and practical flexibility. This study explores reliable and
cost-efficient methods for the accurate conversion of digital number values
acquired from a multispectral imager into reflectance, leveraging real-time
solar spectra as references. To ensure consistent measurements of incident
light, an upward gimbal-mounted downwelling spectrometer was attached to the
UAV, and a sinusoidal model was developed to correct for solar position
variability. Using principal component analysis on the reference solar spectrum
for band selection, a multiple linear regression model with four sensitive
bands (4-Band MLR) and a 30 nm bandwidth achieved performance comparable to the
direct correction method. The root mean square error (RMSE) for reflectance
prediction improved by 86.1% compared to the empirical line method under
fluctuating cloudy conditions and by 59.6% compared to the downwelling light
sensor method averaged across different weather conditions. The RMSE was
calculated as 2.24% in a ground-based diurnal validation, and 2.03% in a UAV
campaign conducted at various times throughout a sunny day. Implementing the
4-Band MLR model enhanced the consistency of canopy reflectance within a
homogeneous vegetation area by 95.0% during spectral imaging in a large rice
field under significant cloud fluctuations. Additionally, improvements of 86.0%
and 90.3% were noted for two vegetation indices: the normalized difference
vegetation index (NDVI; a ratio index) and the difference vegetation index
(DVI; a non-ratio index), respectively.",2024-12-27T08:41:46Z,http://arxiv.org/abs/2412.19527v1,"Jiayang Xie, Yutao Shen, Haiyan Cen"
"PLN and NARS Often Yield Similar strength $\times$ confidence Given
  Highly Uncertain Term Probabilities","We provide a comparative analysis of the deduction, induction, and abduction
formulas used in Probabilistic Logic Networks (PLN) and the Non-Axiomatic
Reasoning System (NARS), two uncertain reasoning frameworks aimed at AGI. One
difference between the two systems is that, at the level of individual
inference rules, PLN directly leverages both term and relationship
probabilities, whereas NARS only leverages relationship frequencies and has no
simple analogue of term probabilities. Thus we focus here on scenarios where
there is high uncertainty about term probabilities, and explore how this
uncertainty influences the comparative inferential conclusions of the two
systems. We compare the product of strength and confidence ($s\times c$) in PLN
against the product of frequency and confidence ($f\times c$) in NARS
(quantities we refer to as measuring the ""power"" of an uncertain statement) in
cases of high term probability uncertainty, using heuristic analyses and
elementary numerical computations. We find that in many practical situations
with high term probability uncertainty, PLN and NARS formulas give very similar
results for the power of an inference conclusion, even though they sometimes
come to these similar numbers in quite different ways.",2024-12-27T08:31:19Z,http://arxiv.org/abs/2412.19524v1,Ben Goertzel
"Exploiting Domain-Specific Parallel Data on Multilingual Language Models
  for Low-resource Language Translation","Neural Machine Translation (NMT) systems built on multilingual
sequence-to-sequence Language Models (msLMs) fail to deliver expected results
when the amount of parallel data for a language, as well as the language's
representation in the model are limited. This restricts the capabilities of
domain-specific NMT systems for low-resource languages (LRLs). As a solution,
parallel data from auxiliary domains can be used either to fine-tune or to
further pre-train the msLM. We present an evaluation of the effectiveness of
these two techniques in the context of domain-specific LRL-NMT. We also explore
the impact of domain divergence on NMT model performance. We recommend several
strategies for utilizing auxiliary parallel data in building domain-specific
NMT models for LRLs.",2024-12-27T08:25:52Z,http://arxiv.org/abs/2412.19522v1,"Surangika Ranathungaa, Shravan Nayak, Shih-Ting Cindy Huang, Yanke Mao, Tong Su, Yun-Hsiang Ray Chan, Songchen Yuan, Anthony Rinaldi, Annie En-Shiun Lee"
"Lévy Score Function and Score-Based Particle Algorithm for Nonlinear
  Lévy--Fokker--Planck Equations","The score function for the diffusion process, also known as the gradient of
the log-density, is a basic concept to characterize the probability flow with
important applications in the score-based diffusion generative modelling and
the simulation of It\^{o} stochastic differential equations. However, neither
the probability flow nor the corresponding score function for the
diffusion-jump process are known. This paper delivers mathematical derivation,
numerical algorithm, and error analysis focusing on the corresponding score
function in non-Gaussian systems with jumps and discontinuities represented by
the nonlinear L\'{e}vy--Fokker--Planck equations. We propose the L\'{e}vy score
function for such stochastic equations, which features a nonlocal
double-integral term, and we develop its training algorithm by minimizing the
proposed loss function from samples. Based on the equivalence of the
probability flow with deterministic dynamics, we develop a self-consistent
score-based transport particle algorithm to sample the interactive L\'{e}vy
stochastic process at discrete time grid points. We provide error bound for the
Kullback--Leibler divergence between the numerical and true probability density
functions by overcoming the nonlocal challenges in the L\'{e}vy score. The full
error analysis with the Monte Carlo error and the time discretization error is
furthermore established. To show the usefulness and efficiency of our approach,
numerical examples from applications in biology and finance are tested.",2024-12-27T08:23:04Z,http://arxiv.org/abs/2412.19520v1,"Yuanfei Huang, Chengyu Liu, Xiang Zhou"
"Improved measurements of neutron lifetime with cold neutron beam at
  J-PARC","The ``neutron lifetime puzzle'' arises from the discrepancy between neutron
lifetime measurements obtained using the beam method, which measures decay
products, and the bottle method, which measures the disappearance of neutrons.
To resolve this puzzle, we conducted an experiment using a pulsed cold neutron
beam at J-PARC. In this experiment, the neutron lifetime is determined from the
ratio of neutron decay counts to $^3$He(n,p)$^3$H reactions in a gas detector.
This experiment belongs to the beam method but differs from previous
experiments that measured protons, as it instead detects electrons, enabling
measurements with distinct systematic uncertainties. By enlarging the beam
transport system and reducing systematic uncertainties, we achieved a fivefold
improvement in precision. Analysis of all acquired data yielded a neutron
lifetime of $\tau_{\rm n}=877.2~\pm~1.7_{\rm(stat.)}~^{+4.0}_{-3.6}{}_{\rm
(sys.)}$ s. This result is consistent with bottle method measurements but
exhibits a 2.3$\sigma$ tension with the average value obtained from the
proton-detection-based beam method.",2024-12-27T08:19:54Z,http://arxiv.org/abs/2412.19519v1,"Y. Fuwa, T. Hasegawa, K. Hirota, T. Hoshino, R. Hosokawa, G. Ichikawa, S. Ieki, T. Ino, Y. Iwashita, M. Kitaguchi, R. Kitahara, S. Makise, K. Mishima, T. Mogi, N. Nagakura, H. Oide, H. Okabe, H. Otono, Y. Seki, D. Sekiba, T. Shima, H. E. Shimizu, H. M. Shimizu, N. Sumi, H. Sumino, M. Tanida, H. Uehara, T. Yamada, S. Yamashita, K. Yano, T. Yoshioka"
"Estimation of System Parameters Including Repeated Cross-Sectional Data
  through Emulator-Informed Deep Generative Model","Differential equations (DEs) are crucial for modeling the evolution of
natural or engineered systems. Traditionally, the parameters in DEs are
adjusted to fit data from system observations. However, in fields such as
politics, economics, and biology, available data are often independently
collected at distinct time points from different subjects (i.e., repeated
cross-sectional (RCS) data). Conventional optimization techniques struggle to
accurately estimate DE parameters when RCS data exhibit various
heterogeneities, leading to a significant loss of information. To address this
issue, we propose a new estimation method called the emulator-informed
deep-generative model (EIDGM), designed to handle RCS data. Specifically, EIDGM
integrates a physics-informed neural network-based emulator that immediately
generates DE solutions and a Wasserstein generative adversarial network-based
parameter generator that can effectively mimic the RCS data. We evaluated EIDGM
on exponential growth, logistic population models, and the Lorenz system,
demonstrating its superior ability to accurately capture parameter
distributions. Additionally, we applied EIDGM to an experimental dataset of
Amyloid beta 40 and beta 42, successfully capturing diverse parameter
distribution shapes. This shows that EIDGM can be applied to model a wide range
of systems and extended to uncover the operating principles of systems based on
limited data.",2024-12-27T08:19:23Z,http://arxiv.org/abs/2412.19517v1,"Hyunwoo Cho, Sung Woong Cho, Hyeontae Jo, Hyung Ju Hwang"
Dynamical phase transitions in certain non-ergodic stochastic processes,"We present a class of stochastic processes in which the large deviation
functions of time-integrated observables exhibit singularities that relate to
dynamical phase transitions of trajectories. These illustrative examples
include Brownian motion with a death rate or in the presence of an absorbing
wall, for which we consider a set of empirical observables such as the net
displacement, local time, residence time, and area under the trajectory. Using
a backward Fokker-Planck approach, we derive the large deviation functions of
these observables, and demonstrate how singularities emerge from a competition
between survival and diffusion. Furthermore, we analyse this scenario using an
alternative approach with tilted operators, showing that at the singular point,
the effective dynamics undergoes an abrupt transition. Extending this approach,
we show that similar transitions may generically arise in Markov chains with
transient states. This scenario is robust and generalizable for non-Markovian
dynamics and for many-body systems, potentially leading to multiple dynamical
phase transitions.",2024-12-27T08:16:47Z,http://arxiv.org/abs/2412.19516v1,"Yogeesh Reddy Yerrababu, Satya N. Majumdar, Tridib Sadhu"
"Real-time classification of EEG signals using Machine Learning
  deployment","The prevailing educational methods predominantly rely on traditional
classroom instruction or online delivery, often limiting the teachers' ability
to engage effectively with all the students simultaneously. A more intrinsic
method of evaluating student attentiveness during lectures can enable the
educators to tailor the course materials and their teaching styles in order to
better meet the students' needs. The aim of this paper is to enhance teaching
quality in real time, thereby fostering a higher student engagement in the
classroom activities. By monitoring the students' electroencephalography (EEG)
signals and employing machine learning algorithms, this study proposes a
comprehensive solution for addressing this challenge. Machine learning has
emerged as a powerful tool for simplifying the analysis of complex variables,
enabling the effective assessment of the students' concentration levels based
on specific parameters. However, the real-time impact of machine learning
models necessitates a careful consideration as their deployment is concerned.
This study proposes a machine learning-based approach for predicting the level
of students' comprehension with regard to a certain topic. A browser interface
was introduced that accesses the values of the system's parameters to determine
a student's level of concentration on a chosen topic. The deployment of the
proposed system made it necessary to address the real-time challenges faced by
the students, consider the system's cost, and establish trust in its efficacy.
This paper presents the efforts made for approaching this pertinent issue
through the implementation of innovative technologies and provides a framework
for addressing key considerations for future research directions.",2024-12-27T08:14:28Z,http://arxiv.org/abs/2412.19515v1,"Swati Chowdhuri, Satadip Saha, Samadrita Karmakar, Ankur Chanda"
"HBT interferometry and Quantum Detection of Primordial Gravitational
  Waves in Hořava-Lifshitz Gravity","Ho\v{r}ava-Lifshitz gravity (to be precise, its projectable version) is
recognized as a renormalizable, unitary, and asymptotically free quantum field
theory of gravity. Notably, one of its cosmological predictions is that it can
produce scale-invariant primordial density fluctuations and primordial
gravitational waves without relying on inflation. In this paper, we investigate
the quantum nature of the primordial gravitational waves generated in
Ho\v{r}ava-Lifshitz gravity. It has been suggested that, for some inflationary
models, the non-classicality of primordial gravitational waves in the squeezed
coherent quantum state can be detected using the Hanbury Brown - Twiss (HBT)
interferometry. We show that in Ho\v{r}ava-Lifshitz gravity, scale-invariant
primordial gravitational waves can be generated during both the
radiation-dominated and matter-dominated eras of the Universe. Moreover, the
frequency range of their quantum signatures is shown to extend beyond that of
inflationary models.",2024-12-27T08:13:52Z,http://arxiv.org/abs/2412.19514v1,"Sugumi Kanno, Hiroki Matsui, Shinji Mukohyama"
